{
  "$schema": "http://json-schema.org/draft-07/schema#",
  "title": "NHMS Timeseries Retention Receipt",
  "type": "object",
  "additionalProperties": false,
  "required": ["schema_version", "generated_at", "mode", "outcome", "archive_gate"],
  "properties": {
    "legacy_chunks": {
      "type": "object",
      "additionalProperties": false,
      "patternProperties": {
        "^(hydro\\.river_timeseries_legacy|met\\.forcing_station_timeseries_legacy)$": {"type": "integer", "minimum": 0}
      }
    },
    "schema_version": {"const": "1.1"},
    "generated_at": {"type": "string", "format": "date-time"},
    "reference_time": {"type": "string", "format": "date-time"},
    "cutoff": {"type": "string", "format": "date-time"},
    "window_days": {"type": "integer", "minimum": 1},
    "mode": {"enum": ["dry-run", "enforce"]},
    "outcome": {"enum": ["dry-run", "refused", "enforced"]},
    "archive_gate": {
      "type": "object",
      "additionalProperties": false,
      "required": ["mode"],
      "properties": {
        "mode": {"enum": ["enabled", "disabled"]},
        "adr_reference": {
          "const": "docs/adr/0002-node27-timeseries-hot-cold-tiering.md Revision 2026-08-11"
        }
      },
      "oneOf": [
        {"properties": {"mode": {"const": "enabled"}}, "not": {"required": ["adr_reference"]}},
        {"properties": {"mode": {"const": "disabled"}}, "required": ["adr_reference"]}
      ]
    },
    "refusal_reason": {"type": "string", "minLength": 1},
    "candidate_chunks": {"type": "array", "items": {"type": "string", "minLength": 1}},
    "dropped_chunks": {
      "type": "array",
      "items": {
        "type": "object",
        "additionalProperties": false,
        "required": ["name", "freed_bytes"],
        "properties": {
          "name": {"type": "string", "minLength": 1},
          "freed_bytes": {"type": "integer", "minimum": 0}
        }
      }
    },
    "deferred_remainder": {"type": "array", "items": {"type": "string", "minLength": 1}},
    "salvage_backed_windows": {"type": "array", "items": {"$ref": "#/definitions/window"}}
  },
  "definitions": {
    "window": {
      "type": "object",
      "additionalProperties": false,
      "required": ["start", "end"],
      "properties": {
        "start": {"type": "string", "format": "date-time"},
        "end": {"type": "string", "format": "date-time"}
      }
    }
  },
  "oneOf": [
    {
      "properties": {"mode": {"const": "dry-run"}, "outcome": {"const": "dry-run"}},
      "required": ["candidate_chunks", "deferred_remainder"],
      "not": {
        "anyOf": [
          {"required": ["refusal_reason"]},
          {"required": ["dropped_chunks"]},
          {"required": ["salvage_backed_windows"]}
        ]
      }
    },
    {
      "properties": {"mode": {"const": "enforce"}, "outcome": {"const": "refused"}},
      "required": ["refusal_reason"],
      "not": {
        "anyOf": [
          {"required": ["candidate_chunks"]},
          {"required": ["dropped_chunks"]},
          {"required": ["deferred_remainder"]},
          {"required": ["salvage_backed_windows"]}
        ]
      }
    },
    {
      "properties": {"mode": {"const": "enforce"}, "outcome": {"const": "enforced"}},
      "required": ["dropped_chunks", "deferred_remainder", "salvage_backed_windows"],
      "not": {"anyOf": [{"required": ["refusal_reason"]}, {"required": ["candidate_chunks"]}]}
    }
  ]
}
