{"archive_gate":{"adr_reference":"docs/adr/0002-node27-timeseries-hot-cold-tiering.md Revision 2026-08-11","mode":"disabled"},"cutoff":"2026-07-21T12:00:00Z","deferred_remainder":[],"dropped_chunks":[{"freed_bytes":369524736,"name":"_timescaledb_internal._hyper_1_11_chunk"}],"generated_at":"2026-08-14T09:58:02.839946Z","mode":"enforce","outcome":"enforced","reference_time":"2026-08-11T12:00:00Z","salvage_backed_windows":[],"schema_version":"1.1","window_days":21}
