{
  "schema_version": "1.1",
  "generated_at": "2026-07-11T12:30:00Z",
  "mode": "enforce",
  "outcome": "enforced",
  "archive_gate": {
    "mode": "disabled",
    "adr_reference": "docs/adr/0002-node27-timeseries-hot-cold-tiering.md Revision 2026-08-11"
  },
  "dropped_chunks": [{"name": "_hyper_1_42_chunk", "freed_bytes": 1073741824}],
  "deferred_remainder": ["_hyper_1_43_chunk"],
  "salvage_backed_windows": [],
  "legacy_chunks": {"hydro.river_timeseries_legacy": 1}
}
